{
  "schema_version": "1.0.0", "record_set_id": "EA-RS-011", "case_id": "EA-MC-011",
  "action": {"action_id": "EA-ACT-011", "operation_type": "single_action", "occurred_at": "2026-07-20T10:25:00Z", "boundary": {"start": "vendor-email-proposal", "end": "vendor-email-result", "stopping_condition": "send attempt resolved"}, "classification_fields": {"domain": "procurement", "operation_kind": "external_communication", "counterparty_type": "vendor", "external_effect": true, "applies_decision_rule": true}, "observable_action": {"recipient": "vendor.example", "content": "Please confirm dummy TOKEN-11.", "result": "sent"}},
  "record_inventory": [
    {"evidence_slot": "delegation_instrument", "state": "missing_after_declared_search", "record_ids": [], "search_scope": "Negative classifier fixture."}, {"evidence_slot": "decision_rule", "state": "missing_after_declared_search", "record_ids": [], "search_scope": "Negative classifier fixture."}, {"evidence_slot": "approval_policy", "state": "missing_after_declared_search", "record_ids": [], "search_scope": "Negative classifier fixture."}, {"evidence_slot": "governance_procedure", "state": "missing_after_declared_search", "record_ids": [], "search_scope": "Negative classifier fixture."}, {"evidence_slot": "runtime_snapshot", "state": "missing_after_declared_search", "record_ids": [], "search_scope": "Negative classifier fixture."}, {"evidence_slot": "context_manifest", "state": "missing_after_declared_search", "record_ids": [], "search_scope": "Negative classifier fixture."}, {"evidence_slot": "trajectory_trace", "state": "missing_after_declared_search", "record_ids": [], "search_scope": "Negative classifier fixture."}, {"evidence_slot": "preservation_manifest", "state": "missing_after_declared_search", "record_ids": [], "search_scope": "Negative classifier fixture."}, {"evidence_slot": "bearer_registry", "state": "missing_after_declared_search", "record_ids": [], "search_scope": "Negative classifier fixture."}, {"evidence_slot": "remedy_forum_registry", "state": "missing_after_declared_search", "record_ids": [], "search_scope": "Negative classifier fixture."}
  ],
  "records": [],
  "privacy_and_burden": {"data_classification": "harmless_synthetic", "collection_purpose": "negative classifier fixture", "minimization_measure": "Dummy token only.", "retention_rule": "Retain with negative fixture.", "protected_material_route": "No protected material.", "review_minutes_estimate": 1, "reviewer_burden_level": "low", "privacy_risks": [], "security_risks": [], "tolerance_status": "within_declared_tolerance"}
}
