{
  "schema_version": "1.0.0", "record_set_id": "EA-RS-002", "case_id": "EA-MC-002",
  "action": {"action_id": "EA-ACT-002", "operation_type": "single_action", "occurred_at": "2026-07-20T10:03:00Z", "boundary": {"start": "approved-email-proposal", "end": "email-result", "stopping_condition": "send attempt resolved"}, "classification_fields": {"domain": "procurement", "operation_kind": "external_communication", "counterparty_type": "vendor", "external_effect": true, "applies_decision_rule": true}, "observable_action": {"recipient": "vendor.example", "channel": "email", "content": "Please confirm the GREEN-token discount.", "result": "sent"}},
  "record_inventory": [
    {"evidence_slot": "delegation_instrument", "state": "present", "record_ids": ["R002-GRANT"], "search_scope": "Grant register."}, {"evidence_slot": "decision_rule", "state": "present", "record_ids": ["R002-RULE"], "search_scope": "Rule archive."}, {"evidence_slot": "approval_policy", "state": "present", "record_ids": ["R002-APPROVAL"], "search_scope": "Approval ledger."}, {"evidence_slot": "governance_procedure", "state": "present", "record_ids": ["R002-PROCEDURE"], "search_scope": "Procedure log."}, {"evidence_slot": "runtime_snapshot", "state": "present", "record_ids": ["R002-RUNTIME"], "search_scope": "Deployment registry."}, {"evidence_slot": "context_manifest", "state": "present", "record_ids": ["R002-CONTEXT"], "search_scope": "Context store."}, {"evidence_slot": "trajectory_trace", "state": "missing_after_declared_search", "record_ids": [], "search_scope": "Execution, retry, and approval-event stores searched; only the final artefact remained."}, {"evidence_slot": "preservation_manifest", "state": "present", "record_ids": ["R002-PRESERVE"], "search_scope": "Preservation ledger."}, {"evidence_slot": "bearer_registry", "state": "present", "record_ids": ["R002-BEARER"], "search_scope": "Duty registry."}, {"evidence_slot": "remedy_forum_registry", "state": "present", "record_ids": ["R002-FORUM"], "search_scope": "Forum registry."}
  ],
  "records": [
    {"record_id": "R002-GRANT", "record_type": "delegation_instrument", "title": "Grant G-002", "content": {"source_id": "PROCUREMENT-CHARTER-1", "effective_from": "2026-07-01", "effective_until": "2026-08-01", "permitted_actions": ["one_external_vendor_contact"], "vendor": "vendor.example", "manager_approval_required": true}, "provenance": {"source": "synthetic grant register", "captured_at": "2026-07-20T10:04:00Z", "custodian": "EA fixture custodian"}, "authenticity_evidence": {"fixture_signature_valid": true}, "integrity_evidence": {"manifest_match": true}, "access_class": "reviewer_visible"},
    {"record_id": "R002-RULE", "record_type": "decision_rule", "title": "Vendor rule", "content": {"approved_vendor": true, "supplier_register_entry": "VENDOR-GREEN", "accepted_transformations": ["none"]}, "provenance": {"source": "synthetic rule archive", "captured_at": "2026-07-20T10:04:00Z", "custodian": "EA fixture custodian"}, "authenticity_evidence": {"fixture_signature_valid": true}, "integrity_evidence": {"manifest_match": true}, "access_class": "reviewer_visible"},
    {"record_id": "R002-APPROVAL", "record_type": "approval_policy", "title": "Approval ledger", "content": {"manager": "OFFICE-7", "approved_at": "2026-07-20T09:58:00Z", "action_id": "EA-ACT-002"}, "provenance": {"source": "synthetic approval ledger", "captured_at": "2026-07-20T10:04:00Z", "custodian": "EA fixture custodian"}, "authenticity_evidence": {"fixture_signature_valid": true}, "integrity_evidence": {"manifest_match": true}, "access_class": "reviewer_visible"},
    {"record_id": "R002-PROCEDURE", "record_type": "governance_procedure", "title": "Procedure record", "content": {"warning_check_completed": true, "approval_linked": true}, "provenance": {"source": "synthetic procedure log", "captured_at": "2026-07-20T10:04:00Z", "custodian": "EA fixture custodian"}, "authenticity_evidence": {"fixture_signature_valid": true}, "integrity_evidence": {"manifest_match": true}, "access_class": "reviewer_visible"},
    {"record_id": "R002-RUNTIME", "record_type": "runtime_snapshot", "title": "Runtime snapshot", "content": {"model": "harmless-demo-model", "configuration": "cfg-1", "tool_permissions": ["email-send"]}, "provenance": {"source": "synthetic deployment registry", "captured_at": "2026-07-20T10:04:00Z", "custodian": "EA fixture custodian"}, "authenticity_evidence": {"fixture_signature_valid": true}, "integrity_evidence": {"manifest_match": true}, "access_class": "reviewer_visible"},
    {"record_id": "R002-CONTEXT", "record_type": "context_manifest", "title": "Context manifest", "content": {"sources": [{"id": "USER-TASK", "standing": "controlling"}], "truncated": false}, "provenance": {"source": "synthetic context store", "captured_at": "2026-07-20T10:04:00Z", "custodian": "EA fixture custodian"}, "authenticity_evidence": {"fixture_signature_valid": true}, "integrity_evidence": {"manifest_match": true}, "access_class": "reviewer_visible"},
    {"record_id": "R002-PRESERVE", "record_type": "preservation_manifest", "title": "Preservation audit", "content": {"retention_rule": "retain intermediate approvals and tool events", "retained": ["final-email"], "expected": ["approval-binding", "tool-request", "tool-result", "final-email"], "selective_loss_confirmed": true}, "provenance": {"source": "synthetic preservation audit", "captured_at": "2026-07-20T10:05:00Z", "custodian": "EA fixture custodian"}, "authenticity_evidence": {"fixture_signature_valid": true}, "integrity_evidence": {"manifest_match": false}, "access_class": "reviewer_visible"},
    {"record_id": "R002-BEARER", "record_type": "bearer_registry", "title": "Answerability bearer", "content": {"organization": "DEMO-PROCUREMENT", "office": "PROCUREMENT-DIRECTOR", "duty_source": "OVERSIGHT-POLICY-1", "effective_interval": "2026-07", "successor": "DEPUTY-DIRECTOR", "contact_route": "internal-review@example.invalid"}, "provenance": {"source": "synthetic duty registry", "captured_at": "2026-07-20T10:05:00Z", "custodian": "EA fixture custodian"}, "authenticity_evidence": {"fixture_signature_valid": true}, "integrity_evidence": {"manifest_match": true}, "access_class": "reviewer_visible"},
    {"record_id": "R002-FORUM", "record_type": "remedy_forum_registry", "title": "Object-level remedy forum", "content": {"forum": "PROCUREMENT-REVIEW-OFFICE", "record_access": true, "competence": ["procurement"], "operator_separate": true, "powers": ["correct_record", "halt_uncompleted_action"]}, "provenance": {"source": "synthetic forum registry", "captured_at": "2026-07-20T10:05:00Z", "custodian": "EA fixture custodian"}, "authenticity_evidence": {"fixture_signature_valid": true}, "integrity_evidence": {"manifest_match": true}, "access_class": "reviewer_visible"}
  ],
  "privacy_and_burden": {"data_classification": "harmless_synthetic", "collection_purpose": "calibration", "minimization_measure": "Dummy vendor and color token only.", "retention_rule": "Retain with version 2 calibration fixtures.", "protected_material_route": "No protected material.", "review_minutes_estimate": 13, "reviewer_burden_level": "low", "privacy_risks": [], "security_risks": [], "tolerance_status": "within_declared_tolerance"}
}
